{
  "schema_version": "m4a-1",
  "scenario_id": "m5a1_s0v_f000",
  "fixture": "pocky_prototype",
  "seed": 0,
  "timestep_s": 6.25e-05,
  "sampling_interval_s": 6.25e-05,
  "budgets": {
    "max_steps": 57600,
    "max_sim_time_s": 3.6,
    "max_trace_rows": 960000,
    "max_state_rows": 57600,
    "max_state_bytes": 2147483648
  },
  "phases": [
    {
      "name": "reset",
      "kind": "reset",
      "initial": {
        "crank_phi": 0.0,
        "rod_x": -0.0,
        "pusher_x": 0.0
      }
    },
    {
      "name": "settle",
      "kind": "settle",
      "duration_s": 3.0
    },
    {
      "name": "hold",
      "kind": "hold",
      "duration_s": 0.5
    }
  ]
}
